{
  "compose_bundle": 1,
  "title": "Heim & Kratzer — Semantics in Generative Grammar",
  "authors": "Irene Heim & Angelika Kratzer (1998)",
  "chapters": [
    {
      "prefix": "hk1",
      "label": "§1",
      "title": "Conventions & the Fregean Program"
    },
    {
      "prefix": "hk2",
      "label": "§2",
      "title": "Function Application & Semantic Types"
    },
    {
      "prefix": "hk4",
      "label": "§4",
      "title": "Predicates, Modifiers & the Definite Article"
    },
    {
      "prefix": "hk5",
      "label": "§5",
      "title": "Relative Clauses & Predicate Abstraction"
    },
    {
      "prefix": "hk6",
      "label": "§6",
      "title": "Quantifiers: Their Semantic Type"
    },
    {
      "prefix": "hk7",
      "label": "§7",
      "title": "Quantification & Grammar"
    },
    {
      "prefix": "hk9",
      "label": "§9",
      "title": "Bound & Referential Pronouns"
    },
    {
      "prefix": "hk12",
      "label": "§12",
      "title": "First Steps Towards an Intensional Semantics"
    }
  ],
  "exercises": [
    {
      "key": "hk1-conventions",
      "title": "Conventions: Types, ⟦·⟧, and =1 (§1)",
      "content": {
        "compose": 1,
        "id": "hk1-conventions",
        "title": "Conventions: Types, ⟦·⟧, and =1 (§1)",
        "subtitle": "Heim & Kratzer — the notation key for the whole bundle (reading-focused)",
        "notation": "hk",
        "domain": {
          "multiLetterNames": true,
          "constants": {
            "e": "a jn"
          },
          "variables": {
            "e": "x y z",
            "et": "f g P Q",
            "t": "p q"
          }
        },
        "lexicon": [
          {
            "words": [
              "Ann"
            ],
            "denotation": "a"
          },
          {
            "words": [
              "Jan"
            ],
            "denotation": "jn"
          },
          {
            "words": [
              "cat"
            ],
            "denotation": "Lx.cat(x)"
          },
          {
            "words": [
              "smokes",
              "smoke"
            ],
            "denotation": "Lx.smoke(x)"
          }
        ],
        "rules": {
          "composition": {
            "functionApplication": true,
            "nonBranchingNodes": true
          }
        },
        "exercises": [
          {
            "title": "A. Warm-up: individuals and characteristic functions",
            "instructions": "Before any composition rules: a name denotes an individual (type e); a predicate denotes a characteristic function (type ⟨e,t⟩), written with =1. These two leaf denotations are the atoms everything else is built from. (See the reading for the full notation key.)",
            "items": [
              {
                "sentence": "Ann",
                "tree": "[.DP [.N Ann ] ]",
                "targets": [
                  "a"
                ],
                "reading": {
                  "section": "1"
                }
              },
              {
                "sentence": "cat",
                "tree": "[.NP [.N cat ] ]",
                "targets": [
                  "λx.cat(x)"
                ],
                "reading": {
                  "section": "1"
                }
              },
              {
                "sentence": "Ann smokes.",
                "tree": "[.S [.DP [.N Ann ] ] [.VP [.V smokes ] ] ]",
                "targets": [
                  "smoke(a)"
                ],
                "reading": {
                  "section": "1"
                }
              }
            ]
          }
        ],
        "reading": {
          "format": "lingdown",
          "markdown": "# Chapter 1 · Truth-Conditional Semantics and the Fregean Program\n\n*This chapter sets the conventions every later H&K set uses. There are no trees to\ncompose yet — read it as the notation key for the bundle.*\n\nTo know the meaning of a sentence is, in large part, to know its **truth\nconditions** — the circumstances under which it is true. A semantic theory pairs\neach sentence with its truth conditions and shows how they are **composed** from the\nmeanings of the parts (Frege's Principle of Compositionality).\n\n## Sets and characteristic functions\n\nA set `A` can be given by listing (`{a, b, c}`) or by **abstraction** — a condition\nits members satisfy: `{x : x is a cat}`, \"the set of all `x` such that `x` is a cat.\"\n\nEvery set has a **characteristic function**: the function mapping an object to `1`\nif it is in the set, and to `0` otherwise. Sets and their characteristic functions\nare interchangeable, and **we use functions throughout**. So the meaning of *cat* is\nthe function\n\n```deriv\n[[cat]] = λx . cat(x)=1\n```\n\n— *the function mapping each `x` to `1` if `x` is a cat, and to `0` otherwise.* This\nis why, in every H&K set, a one-place predicate is written with the **`=1`**\nconvention: the value is a truth value, and `cat(x)=1` says that value is `1`.\n\n## Notation key for the bundle\n\n- **`⟦α⟧`** — the denotation (extension) of expression `α`. Later, `⟦α⟧^g` adds a\n  variable assignment (Ch 5, 9) and `⟦α⟧^w` a world (Ch 12).\n- **Semantic types.** `e` is the type of **individuals**; `t` the type of **truth\n  values** (`{0,1}`). If `σ` and `τ` are types, `⟨σ,τ⟩` is the type of functions from\n  `σ` to `τ`. So `⟨e,t⟩` is a one-place predicate, `⟨e,⟨e,t⟩⟩` a transitive verb,\n  `⟨⟨e,t⟩,t⟩` a generalized quantifier.\n- **`D_σ`** — the **domain** of type `σ`: `D_e` the individuals, `D_t = {0,1}`,\n  `D_{⟨e,t⟩}` the one-place predicates, and so on.\n- **`=1`** — predicates are characteristic functions, so conditions are written\n  `P(x)=1`, `∀x[P(x)=1 → Q(x)=1]`, etc. (This is the bundle-wide convention; the\n  engine treats `P(x)=1` and `P(x)` as the same proposition.)\n- **λ-notation** — `λx . φ` names *the function mapping each `x` to `φ`*. A partial\n  function adds a **definedness condition** after a colon, `λx : ψ . φ` — defined\n  only when `ψ` holds (Frege's *the*, Ch 4; *both*/*neither*, Ch 6).\n\n## The plan\n\nThe chapters build one fragment incrementally: **Function Application** and the\nbasic types (Ch 2), **Predicate Modification** and the partial definite article\n(Ch 4), **Predicate Abstraction** and relative clauses (Ch 5), **generalized\nquantifiers** (Ch 6), **quantifier movement** and scope (Ch 7), **pronouns and\nbinding** (Ch 9). Each adds the smallest machinery needed for the next range of\ndata — the methodology is as much the point as the results.\n"
        }
      }
    },
    {
      "key": "hk2-fa",
      "title": "Function Application & Semantic Types (§2.1–2.4)",
      "content": {
        "compose": 1,
        "id": "hk2-fa",
        "title": "Function Application & Semantic Types (§2.1–2.4)",
        "subtitle": "Heim & Kratzer — the first Fregean fragment: FA, types e/t, transitive verbs, connectives",
        "notation": "hk",
        "domain": {
          "multiLetterNames": true,
          "constants": {
            "e": "a jn mr"
          },
          "variables": {
            "e": "x y z",
            "et": "f g P Q X Y",
            "t": "p q"
          }
        },
        "lexicon": [
          {
            "words": [
              "Ann"
            ],
            "denotation": "a"
          },
          {
            "words": [
              "Jan"
            ],
            "denotation": "jn"
          },
          {
            "words": [
              "Maria"
            ],
            "denotation": "mr"
          },
          {
            "words": [
              "smokes",
              "smoke"
            ],
            "denotation": "Lx.smoke(x)"
          },
          {
            "words": [
              "works",
              "work"
            ],
            "denotation": "Lx.work(x)"
          },
          {
            "words": [
              "is"
            ],
            "denotation": "LX.X"
          },
          {
            "words": [
              "boring"
            ],
            "denotation": "Lx.boring(x)"
          },
          {
            "words": [
              "likes",
              "like"
            ],
            "denotation": "Ly.Lx.like(x,y)"
          },
          {
            "words": [
              "knows",
              "know"
            ],
            "denotation": "Ly.Lx.know(x,y)"
          },
          {
            "words": [
              "and"
            ],
            "denotation": "Lp.Lq.q ∧ p",
            "displayAs": "and"
          },
          {
            "words": [
              "itisnotthecasethat",
              "not"
            ],
            "denotation": "Lp.~p",
            "displayAs": "it is not the case that"
          }
        ],
        "rules": {
          "composition": {
            "functionApplication": true,
            "nonBranchingNodes": true
          }
        },
        "exercises": [
          {
            "title": "A. Intransitive verbs: FA, types e and ⟨e,t⟩ (§2.1)",
            "instructions": "A name denotes an individual (type e); an intransitive verb denotes a characteristic function (type ⟨e,t⟩). Functional Application feeds the subject to the verb. The copula is is vacuous (λX.X).",
            "items": [
              {
                "sentence": "Ann smokes.",
                "tree": "[.S [.NP [.N Ann ] ] [.VP [.V smokes ] ] ]",
                "targets": [
                  "smoke(a)"
                ],
                "reading": {
                  "section": "2.1"
                }
              },
              {
                "sentence": "Maria works.",
                "tree": "[.S [.NP [.N Maria ] ] [.VP [.V works ] ] ]",
                "targets": [
                  "work(mr)"
                ],
                "reading": {
                  "section": "2.1"
                }
              },
              {
                "sentence": "Ann is boring.",